{"hushspec_assessment_context":"0.1.0","assessment_plan":{"path":"ap.json","sha256":"sha256:31e126c83b6365a73f86e028137926040cf3ce7d1f02eed0732ee26887fd23f1"},"system_security_plan":{"path":"ssp.json","sha256":"sha256:a23d9d0dc27286b7c95ee9088bdb23b1259424f62193550401e029e10cb3fafa"},"resolved_catalog":{"path":"catalog.json","sha256":"sha256:9ab36193312edd04d61389b6eba0d97c72f1402267555947880bdb568cbc9d96"}}
